{
  "run_id": "20260714T162026Z-ministral-3-latest-f0eddc92",
  "status": "scored",
  "started_at": "2026-07-14T16:20:26.060552+00:00",
  "benchmark_version": "0.1.0",
  "dataset_digest": "60e432a4e04559a2e5f5e731fe7afe6ae75eaf77b142e5b2760fc270eed442b0",
  "runner_revision": null,
  "scorer_version": "0.1.0",
  "model": "ministral-3:latest",
  "model_revision": null,
  "provider": "ollama",
  "quantization": null,
  "system_prompt": null,
  "generation_config": {
    "temperature": 0.0,
    "top_p": 1.0,
    "max_tokens": 768,
    "seed": 42,
    "thinking": "disabled"
  },
  "repeats": 1,
  "sample_count": 12,
  "environment": {
    "python": "3.12.12",
    "platform": "macOS-15.1-arm64-arm-64bit"
  },
  "verification": "local-provisional",
  "completed_at": "2026-07-14T16:30:02.969569+00:00",
  "judge_models": [
    "gpt-oss:20b",
    "gemma3:12b",
    "gemma4:e4b"
  ],
  "scoring_policy": {
    "min_judges": 2,
    "min_agreement": 0.8,
    "self_judging_allowed": false
  }
}
