{
  "run_id": "20260714T194457Z-gemma3-12b-8878218e",
  "status": "scored",
  "started_at": "2026-07-14T19:44:57.053152+00:00",
  "benchmark_version": "0.1.0",
  "dataset_digest": "60e432a4e04559a2e5f5e731fe7afe6ae75eaf77b142e5b2760fc270eed442b0",
  "runner_revision": "51ea36c9f1f747826492819a67ba8b363214013f",
  "scorer_version": "0.2.0",
  "model": "gemma3:12b",
  "model_revision": null,
  "provider": "ollama-cloud",
  "quantization": null,
  "system_prompt": null,
  "generation_config": {
    "temperature": 0.0,
    "top_p": 1.0,
    "max_tokens": 1024,
    "seed": 42,
    "thinking": "disabled"
  },
  "repeats": 1,
  "protocol": "core",
  "sample_count": 12,
  "environment": {
    "python": "3.12.12",
    "platform": "macOS-15.1-arm64-arm-64bit"
  },
  "verification": "cloud-provisional",
  "visibility": "public",
  "completed_at": "2026-07-14T19:49:50.594008+00:00",
  "judge_models": [
    "gpt-oss:20b",
    "qwen3.5:397b",
    "gemini-3-flash-preview"
  ],
  "scoring_policy": {
    "min_judges": 2,
    "min_agreement": 0.8,
    "self_judging_allowed": false,
    "invalid_json_max_attempts": 2,
    "judge_generation": {
      "temperature": 0.0,
      "top_p": 1.0,
      "max_tokens": 4096,
      "seed": 42,
      "thinking": "low for gpt-oss; disabled otherwise"
    }
  }
}
